date,url,source_name,title,opening_text,hit_sentence,processed_text,sentiment,reach
2025-11-25,https://timesofindia.indiatimes.com/business/financial-literacy/investing/how-to-be-a-value-investor-when-nifty-is-at-26000-sensex-at-85000-guide-to-finding-value-when-the-market-looks-pricey/articleshow/125557554.cms,the times of india,"How to be a value investor when Nifty is at 26,000, Sensex at 85,000: Guide to finding value when the market looks pricey","Even with Nifty at 26,000 and Sensex at 85,000, value investing opportunities persist. Focus on fundamentally sound businesses overlooked ...","... of the year. Then a warning from Sankaran Naren, CIO of ICICI Prudential Mutual Fund, triggered an alarm in the markets. By March 2025, ...",how to be a value investor when nifty is at 26000 sensex at 85000 guide to finding value when the market looks pricey even with nifty at 26000 and sensex at 85000 value investing opportunities persist focus on fundamentally sound businesses overlooked,Positive,7749939.0
2026-01-05,https://www.cnbctv18.com/personal-finance/icici-pru-chintan-haria-sips-passive-mutual-funds-2026-outlook-etfs-ws-l-19814058.htm,cnbc-tv18,Why ICICI Pru's Chintan Haria believes SIPs and passive funds will stay in focus in 2026,"Chintan Haria of ICICI Prudential AMC predicts investors will favor SIPs, diversified mutual funds, and ETFs like Nifty 500, Nifty Next 50, ...","... to Chintan Haria, Principal – Investment Strategy at ICICI Prudential AMC. Periods of market swings, he said, tend to highlight the ...",why icici prus chintan haria believes sips and passive funds will stay in focus in 2026 chintan haria of icici prudential amc predicts investors will favor sips diversified mutual funds and etfs like nifty 500 nifty next 50,Neutral,
2025-09-29,https://www.money9live.com/share-market/s-naren-market-forecast-know-what-is-opinion-about-market-and-what-should-be-strategy-of-investors-video-72847.html,money9live,"S. Naren का Market Forecast, जानें बाजार को लेकर क्या है राय और निवेशकों की क्या हो स्ट्रैटेजी?","... पिछले एक दशक में भारतीय बाजार ने जो तेजी बनाई है उसने दुनियाभर के कई बाजारों को पीछे छोड़ दिया है. लेकिन अचानक से एक साल में सब पलट गया, ...","... को क्या रणनीति अपनानी चाहिए. इन सभी मुद्दों पर क्या है ICICI Prudential Mutual Fund CIO S. Naren की राय, चलिए आपको बताते हैं इस वीडियो में.",s naren market forecast,Neutral,2033792.0
2025-07-23,https://www.angelone.in/news/best-gold-etfs-in-india-in-august-2025,angel one,Best Gold ETFs in India in August 2025 Based on 5yr CAGR,"ICICI Prudential, HDFC, SBI, Kotak, and Nippon India ETFs lead the list of best Gold ETFs in India for August 2025 by CAGR and returns. ...",,best gold etfs in india in august 2025 based on 5yr cagr icici prudential hdfc sbi kotak and nippon india etfs lead the list of best gold etfs in india for august 2025 by cagr and returns,Neutral,16655916.0
2025-08-27,https://economictimes.indiatimes.com/mf/analysis/18-equity-mutual-funds-gave-over-30-returns-since-last-ganesh-chaturthi/articleshow/123537998.cms,the economic times,18 equity mutual funds gave over 30% returns since last Ganesh Chaturthi,Several international equity mutual funds stood out with stellar returns since last Ganesh Chaturthi. Invesco India – Invesco Global ...,,18 equity mutual funds gave over 30 returns since last ganesh chaturthi several international equity mutual funds stood out with stellar returns since last ganesh chaturthi invesco india invesco global,Positive,12772308.0
2026-01-25,https://www.fortuneindia.com/long-reads/best-investments-2026-the-best-debt-fund-manager/129359,fortune india,Best Investments 2026: The best debt fund manager,Avoiding dramatic bets has helped Manish Banthia deliver in a volatile market.,"Manish Banthia, chief investment officer, fixed income, ICICI Prudential AMC INVESTORS VIEW fixed income as the calmer part of the market ...",best investments 2026 the best debt fund manager avoiding dramatic bets has helped manish banthia deliver in a volatile market,Positive,
2025-08-12,https://www.zeebiz.com/personal-finance/mutual-fund/photo-gallery-top-largecap-midcap-smallcap-mutual-funds-in-3-years-list-aug-11-2025-bse-nifty-100-midcap-150-smallcap-250-tri-benchmark-beating-schemes-list-376128,zee business,"Top 6 MF Schemes in 3 Years: These largecap, midcap, smallcap funds have beaten benchmarks with up to 21% returns; see list","Equity mutual funds have been the talk of the town for the past several months, and counting, with schemes across largecap, midcap and ...",,top 6 mf schemes in 3 years these largecap midcap smallcap funds have beaten benchmarks with up to 21 returns see list equity mutual funds have been the talk of the town for the past several months and counting with schemes across largecap midcap and,Neutral,41256.0
2025-08-13,https://www.reddit.com/r/MutualfundsIndia/comments/1moy5u1/comment/n8gj41q,reddit.com/r/mutualfundsindia,,"Need Advice for ICICI Thematic Advantage & ICICI Equity Savings for 3-Year Horizon (Low Risk, Emergency-Ready)
Hi everyone,

I’m planning to invest ₹10–20 lakh (my mother’s savings) and have shortlisted and will only go with these two mutual funds:

ICICI Prudential Thematic Advantage Fund

ICICI Prudential Equity Savings Fund

Time Horizon: Around 3 years, but I may need to withdraw earlier in case of an emergency.
Goal: Low risk — I want to ensure the money isn’t at a decreased value if withdrawn before 3 years.
Risk Tolerance: Low to moderate (primary focus on capital protection, but want returns better than FD and which can beat inflation in the long run).
Reason for Selection: I’ve already decided on these two funds based on past performance and stability — just need help in deciding the right allocation ratio.

My Questions:

Should I invest all the amount in one of these, or split between them? If split, what ratio is best for low risk and emergency liquidity?

How much downside risk should I expect if I need to redeem within 1–2 years?

Your suggestions will really help, this is a retirement-focused saving for my mom and dad and for our education.

Thanks in advance!

Update: Please also explain what is diff between direct or regular fund and with which we should move ahead?","I would’ve picked an Arbitrage fund or a Short Term Debt Fund for this. But if I’m forced to choose 1 out of the aforementioned choices, I would pick ICICI Equity Savings Fund since it’s a tax efficient version of a Conservative Hybrid Fund. Maybe I’d have divided the money between an Arbitrage Fund and the Equity Savings Fund",need advice for icici thematic advantage icici equity savings for 3year horizon low risk emergencyready hi everyone im planning to invest ₹1020 lakh my mothers savings and have shortlisted and will only go with these two mutual funds icici prudential thematic advantage fund icici prudential equity savings fund time horizon around 3 years but i may need to withdraw earlier in case of an emergency goal low risk i want to ensure the money isnt at a decreased value if withdrawn before 3 years risk tolerance low to moderate primary focus on capital protection but want returns better than fd and which can beat inflation in the long run reason for selection ive already decided on these two funds based on past performance and stability just need help in deciding the right allocation ratio my questions should i invest all the amount in one of these or split between them if split what ratio is best for low risk and emergency liquidity how much downside risk should i expect if i need to redeem within 12 years your suggestions will really help this is a retirementfocused saving for my mom and dad and for our education thanks in advance update please also explain what is diff between direct or regular fund and with which we should move ahead,Neutral,347930.0
2025-08-14,https://obnews.co/Index/flowNewsDetail/id/11578682.html,obnews,"Best SIP Plans in India for Beginners: Low Risk, High Returns Options","Starting your investment journey? SIPs are a great way to begin. Learn about the best low-risk SIP options in India for 2025, balancing ...",,best sip plans in india for beginners low risk high returns options starting your investment journey sips are a great way to begin learn about the best lowrisk sip options in india for 2025 balancing,Positive,3531794.0
2025-08-25,https://www.businessworld.in/article/icici-prudential-asset-management-company-inaugurates-new-office-at-gift-city-announces-india-focused-fund-for-global-investors-568768,bw businessworld,Icici Prudential Asset Management Company Inaugurates New Office At Gift City; Announces India- Focused Fund For Global Investors,"The IFSC Branch was inaugurated by Amar Shah, Chief Business Officer, ICICI Prudential AMC. Also, seen in the picture are Ashutosh Mishra, ...","... was inaugurated by Amar Shah, Chief Business Officer, ICICI Prudential AMC. Also, seen in the picture are Ashutosh Mishra, Principal ...",icici prudential asset management company inaugurates new office at gift city announces india focused fund for global investors the ifsc branch was inaugurated by amar shah chief business officer icici prudential amc also seen in the picture are ashutosh mishra,Neutral,285637.0
2025-10-27,https://www.newspointapp.com/english/business/12-equity-mutual-funds-with-over-rs-1000-nav-deliver-over-15-cagr-since-inception-et/articleshow/145048209f0dd225f005284a4b8acb05ea7e08af,newspointapp,"12 equity mutual funds with over Rs 1,000 NAV deliver over 15% CAGR since inception","Around 12 equity mutual funds had a net asset value ( NAV ) of over Rs 1,000 as of October 24, 2025, and have delivered over 15% CAGR since ...",,12 equity mutual funds with over rs 1000 nav deliver over 15 cagr since inception around 12 equity mutual funds had a net asset value nav of over rs 1000 as of october 24 2025 and have delivered over 15 cagr since,Neutral,12220656.0
2025-11-24,https://economictimes.indiatimes.com/mf/analysis/best-gilt-mutual-funds-to-invest-in-november-2025/articleshow/125531393.cms,the economic times,Best gilt mutual funds to invest in November 2025,Gilt funds are not recommended to regular debt investors because they are risky and volatile. Gilt funds suffer the most when the rates go ...,,best gilt mutual funds to invest in november 2025 gilt funds are not recommended to regular debt investors because they are risky and volatile gilt funds suffer the most when the rates go,Neutral,12220656.0
2025-11-04,https://economictimes.indiatimes.com/mf/mf-news/all-the-risk-now-lies-with-investors-warns-icici-prudential-amcs-sankaran-naren/articleshow/125086832.cms,the economic times,"All the risk now lies with investors, warns ICICI Prudential AMC’s Sankaran Naren","ICICI Prudential AMC CIO Sankaran Naren warned that investment risks now lie entirely with investors, urging diversification into debt and ...","... ICICI Prudential AMC CIO Sankaran Naren warned that investment risks now lie entirely with investors, urging diversification into debt and ...",all the risk now lies with investors warns icici prudential amcs sankaran naren icici prudential amc cio sankaran naren warned that investment risks now lie entirely with investors urging diversification into debt and,Neutral,347930.0
2025-07-10,https://www.cnbctv18.com/personal-finance/icici-pru-chintan-haria-explains-why-time-to-look-at-quality-smart-beta-investing-19635083.htm,cnbc-tv18,Why ICICI Pru MF’s Chintan Haria believes it’s time to look at quality smart beta investing,"Haria explains that when markets turn cautious, investors hunt for fundamentally sound companies—those with strong balance sheets, high ...","... now. Chintan Haria, Principal – Investment Strategy at ICICI Prudential Mutual Fund, believes the signals are lining up. “Quality tends ...",why icici pru mfs chintan haria believes its time to look at quality smart beta investing haria explains that when markets turn cautious investors hunt for fundamentally sound companiesthose with strong balance sheets high,Positive,11569309.0
2025-11-24,https://www.linkedin.com/feed/update/urn%3Ali%3Aactivity%3A7398646200603897857,linkedin,"He will be sharing his insights on “Indian Opportunities Amid Global Uncertainties.” on Saturday, 29th November'25. ","We are pleased to announce that Anish Tawakley , Deputy CIO – Equity, ICICI Prudential AMC Ltd , will be joining us at our Annual Event for ...","We are pleased to announce that Anish Tawakley , Deputy CIO – Equity, ICICI Prudential AMC Ltd , will be joining us at our Annual Event for a special session moderated by Sapna Narang , Managing Partner, Capital League. He will be sharing his insights on “Indian Opportunities",he will be sharing his insights on indian opportunities amid global uncertainties on saturday 29th november25 we are pleased to announce that anish tawakley deputy cio equity icici prudential amc ltd will be joining us at our annual event for,Neutral,
2025-09-08,https://www.newspointapp.com/english-news/publisher-et/business/50-us-tariffs-will-change-a-shah-icici-pru-amc/articleshow/14504820656adbf90647eff5c0e2172a0cdbb6f8,newspointapp,"50% US tariffs will change: A. Shah, ICICI Pru AMC","Anand Shah, CIO-PMS and AIF Investments, ICICI Prudential AMC , in an interview that he expects tariff resolution through dialogue. He ...","Anand Shah, CIO-PMS and AIF Investments, ICICI Prudential AMC , in an interview that he expects tariff resolution through dialogue. He ...",50 us tariffs will change a shah icici pru amc anand shah ciopms and aif investments icici prudential amc in an interview that he expects tariff resolution through dialogue he,Neutral,25084627.0
2026-01-24,https://www.moneycontrol.com/news/business/markets/icici-pru-passive-multi-asset-fof-to-be-grandfathered-new-investments-to-stop-from-january-27-13789521.html,moneycontrol.com,"ICICI Pru Passive Multi-Asset FoF to be ""grandfathered""; new Investments to stop from January 27","As part of the grandfathering process, the scheme will continue with its current structure but will be merged and/or wound up upon ...",,icici pru passive multiasset fof to be grandfathered new investments to stop from january 27 as part of the grandfathering process the scheme will continue with its current structure but will be merged andor wound up upon,Neutral,8244574.0
2026-01-27,https://www.cnbctv18.com/personal-finance/icici-prudential-amc-turns-constructive-on-equities-sees-opportunity-after-market-correction-19834050.htm,cnbc-tv18,"ICICI Prudential AMC turns constructive on equities, sees opportunity after market correction","ICICI Prudential AMC’s Chintan Haria explains why the fund house has reopened small-cap and international funds, highlighting opportunities ...",... ICICI Prudential AMC has turned constructive on equities after a broad-based correction in Indian markets over the last few months. The ...,icici prudential amc turns constructive on equities sees opportunity after market correction icici prudential amcs chintan haria explains why the fund house has reopened smallcap and international funds highlighting opportunities,Positive,2115326.0
2025-12-03,https://www.msn.com/en-in/money/markets/best-sbi-equity-funds-that-shine-across-10-15-and-20-years-here-s-how-they-ranked/ar-AA1RAC4i,msn india,"Best SBI equity funds that shine across 10, 15 and 20 years — here’s how they ranked","... ; ; ; ; When investors look for mutual funds , the natural tendency is to focus on short-term charts. But wealth creation is not a 1-year ...",,best sbi equity funds that shine across 10 15 and 20 years heres how they ranked when investors look for mutual funds the natural tendency is to focus on shortterm charts but wealth creation is not a 1year,Neutral,6319982.0
2025-12-08,https://www.moneycontrol.com/news/business/markets/india-is-an-infinite-market-at-the-right-price-icici-pru-amc-s-nimesh-shah-bets-on-scale-over-margins-13715529.html,moneycontrol.com,MC EXCLUSIVE India is an infinite market at the right price: ICICI Pru AMC's Nimesh Shah bets on scale over margins,"As the AMC heads into its IPO, Shah says low fees strengthen — not strain — the business, backed by counter-cyclical products and a rapidly ...","... Nimesh Shah If you can deliver a low-cost product to India’s middle class, the market is “infinite,” says ICICI Prudential AMC Managing ...",mc exclusive india is an infinite market at the right price icici pru amcs nimesh shah bets on scale over margins as the amc heads into its ipo shah says low fees strengthen not strain the business backed by countercyclical products and a rapidly,Positive,14026100.0
2025-07-07,https://www.reddit.com/r/mutualfunds/comments/1ltxde3,reddit.com/r/mutualfunds,"Is ICICI Prudential Bluechip Fund and ICICI Prudential Large cap fund the same?
I wanted to invest in ICICI Prudential Bluechip fund but couldn't find it on Zerodha Kite. I read somewhere that it was renamed to ICICI Prudential Large cap some time back. Can anyone confirm this if they're the same fund so I don't invest in the wrong one. yes",,,is icici prudential bluechip fund and icici prudential large cap fund the same i wanted to invest in icici prudential bluechip fund but couldnt find it on zerodha kite i read somewhere that it was renamed to icici prudential large cap some time back can anyone confirm this if theyre the same fund so i dont invest in the wrong one yes,Neutral,
2025-11-04,https://www.newspointapp.com/english/astro/passive-investing-now-a-core-strategy-for-portfolio-building-icici-pru-expert-news9live-english/articleshow/14504820526b030f642b4483f14fa47ac6bbed9b,newspointapp,Passive investing now a core strategy for portfolio building: ICICI Pru expert,Kolkata: The popularity of passive investments is rising at an astonishing pace. The AUM in Sept 2025 for passive mutual fund schemes ...,"... be higher. Chintan Haria, principal, investment strategy ICICI Prudential AMC explains the reasons behind the popularity of passive ...",passive investing now a core strategy for portfolio building icici pru expert kolkata the popularity of passive investments is rising at an astonishing pace the aum in sept 2025 for passive mutual fund schemes,Positive,7749939.0
2025-11-27,https://upstox.com/news/personal-finance/mutual-funds/3-equity-et-fs-deliver-32-to-41-cagr-in-5-years-key-points-to-know/article-185354/,upstox,3 equity ETFs deliver 32% to 41% CAGR in 5 years: Key points to know,As many as three equity exchange-traded funds have each delivered an annualised compounded return of more than 30% in the five years ending ...,Government of India in 2017 and is currently managed by ICICI Prudential Mutual Fund. It invests in the constituents of the BSE Bharat 22 ...,3 equity etfs deliver 32 to 41 cagr in 5 years key points to know as many as three equity exchangetraded funds have each delivered an annualised compounded return of more than 30 in the five years ending,Neutral,6268740.0
2026-01-16,https://www.msn.com/en-in/money/topstories/sif-in-focus-icici-pru-mf-floats-isif-equity-ex-top-100-long-short-fund-isif-hybrid-long-short-fund/ar-AA1UkZKB,msn india,"SIF in focus: ICICI Pru MF floats iSIF Equity Ex-Top 100 Long-Short Fund, iSIF Hybrid Long-Short Fund","SIF in focus: ICICI Pru MF floats iSIF Equity Ex-Top 100 Long-Short Fund, iSIF Hybrid Long-Short Fund ; ; ; ICICI Prudential Mutual Fund ...","... the launches, Sankaran Naren, Executive Director and CIO at ICICI Prudential AMC, said the iSIF segment is meant to offer differentiated ...",sif in focus icici pru mf floats isif equity extop 100 longshort fund isif hybrid longshort fund sif in focus icici pru mf floats isif equity extop 100 longshort fund isif hybrid longshort fund icici prudential mutual fund,Neutral,656461.0
2025-11-19,https://www.msn.com/en-in/money/topstories/which-sectors-could-drive-the-next-market-rally-icici-prudential-amc-s-rajat-chandak-explains/ar-AA1QJaGW,msn india,Which sectors could drive the next market rally? ICICI Prudential AMC's Rajat Chandak explains,... ; ; ; ; Assets under management (AUM) of flexi cap funds surged nearly 25% in the past 12 months to a record high of Rs 5.34 lakh crore in ...,"... with Business Today, Rajat Chandak, Senior Fund Manager, ICICI Prudential AMC, shared his insights. Edited excerpts: BT: What’s ...",which sectors could drive the next market rally icici prudential amcs rajat chandak explains assets under management aum of flexi cap funds surged nearly 25 in the past 12 months to a record high of rs 534 lakh crore in,Positive,7749939.0
2026-01-06,https://www.businesstoday.in/mutual-funds/story/where-are-the-best-risk-reward-opportunities-for-the-next-12-months-anand-shah-of-icici-prudential-amc-explains-509597-2026-01-06,business today,Where are the best risk-reward opportunities for the next 12 months? Anand Shah of ICICI Prudential AMC explains,"Anand Shah, CIO - PMS & AIF Investments at ICICI Prudential AMC, shares his insights on portfolio positioning, sectors to favour or avoid, ...","... with BT, Anand Shah, CIO - PMS & AIF Investments at ICICI Prudential AMC, shares his insights on how he is positioning portfolios, ...",where are the best riskreward opportunities for the next 12 months anand shah of icici prudential amc explains anand shah cio pms aif investments at icici prudential amc shares his insights on portfolio positioning sectors to favour or avoid,Neutral,380254.0
2025-11-22,https://www.businesstoday.in/mutual-funds/story/child-funds-compared-icici-childrens-fund-tops-charts-outshines-sbi-magnum-in-consistency-long-term-returns-503294-2025-11-22,business today,"Child funds compared: ICICI leads with 14%+ 5-year CAGR, SBI trails with 12%; what should you choose","Structured children’s mutual funds have emerged as powerful tools for long-term goal planning. Among them, SBI Magnum and ICICI Prudential ...",,child funds compared icici leads with 14 5year cagr sbi trails with 12 what should you choose structured childrens mutual funds have emerged as powerful tools for longterm goal planning among them sbi magnum and icici prudential,Positive,
2025-11-19,https://www.businesstoday.in/markets/stocks/story/which-sectors-could-drive-the-next-market-rally-icici-prudential-amcs-rajat-chandak-explains-502778-2025-11-19,business today,Which sectors could drive the next market rally? ICICI Prudential AMC’s Rajat Chandak explains,The benchmark equity index Nifty50 and Nifty Midcap 150 gained 6% and 5.6% between October 2024 and October 2025.,"Rajat Chandak, Senior Fund Manager, ICICI Prudential AMC Assets under management (AUM) of flexi cap funds surged nearly 25% in the past 12 ...",which sectors could drive the next market rally icici prudential amcs rajat chandak explains the benchmark equity index nifty50 and nifty midcap 150 gained 6 and 56 between october 2024 and october 2025,Positive,14026100.0
2025-11-03,https://obnews.co/Index/flowNewsDetail/id/12624621.html,obnews,Experts Predict Long-Term Shine in Silver: ICICI Prudential AMC Explains Why It Still Holds Strong,"Despite the recent correction in silver prices, experts believe that the metal’s long-term prospects remain strong. According to ICICI ...","... Use Chintan Haria, Principal – Investment Strategy at ICICI Prudential AMC, explained that silver serves a dual purpose in the global ...",experts predict longterm shine in silver icici prudential amc explains why it still holds strong despite the recent correction in silver prices experts believe that the metals longterm prospects remain strong according to icici,Positive,2555786.0
2025-08-12,https://www.angelone.in/news/mutual-funds/3-best-performing-large-cap-mutual-funds-with-up-to-24-annualised-returns-over-5-years,angel one,3 Best Performing Large Cap Mutual Funds with Up to 24% Annualised Returns Over 5 Years,"Discover the top 3 large-cap mutual funds delivering over 20% annualised returns, with the top 2 funds delivering 24% return. These large ...",,3 best performing large cap mutual funds with up to 24 annualised returns over 5 years discover the top 3 largecap mutual funds delivering over 20 annualised returns with the top 2 funds delivering 24 return these large,Positive,5814639.0
2025-07-08,https://www.zeebiz.com/personal-finance/mutual-fund/news-icici-prudential-active-momentum-nfo-opens-minimum-investment-fund-managers-key-details-372622,zee business,"ICICI Prudential Active Momentum NFO opens: Minimum investment, fund managers, key details",The momentum fund is an open-ended equity scheme following a momentum theme and is benchmarked against the Nifty 500 TRI.,"... Naren, Executive Director and Chief Investment Officer at ICICI Prudential AMC stated that we aim to approach momentum fundamentally by ...",icici prudential active momentum nfo opens minimum investment fund managers key details the momentum fund is an openended equity scheme following a momentum theme and is benchmarked against the nifty 500 tri,Neutral,259919.0
