date,url,source_name,title,opening_text,hit_sentence,processed_text,sentiment,reach
2025-08-17,https://www.reddit.com/r/mutualfunds/comments/1mseu7v,reddit.com/r/mutualfunds,"Questions regarding ICICI Prudential Mutual Fund heads S. Naren statement !!
Hello Folks,

I recently came across this X post summarizing statements by S. Naren, the head of ICICI Prudential Mutual Fund. He mentioned that Indian markets are at insane valuations, and that a “lost decade” might come. During the “lost decade” from 1994 to 2004, returns were very weak despite the optimism of the time. Do we feel that there is another crash coming? What are your thoughts on this? I would be delighted if veteran investors could share their opinions. Thank you

Here is the link https://x.com/TheClubJunto/status/1956422671027105937"," have watched this interview.

S Naren is a wise man who explains things in simple terms. Rather- listen to how he says it and what he says directly, instead of reading someone else's summary. Link of this interview: https://www.youtube.com/live/uF-6YaeKHJk

Because I have read some of these summaries and none captured the essence.

My learnings from this interview would be:

Conventional wisdom says: Returns from equity will be lower in next decade than what we saw in last decade.

Conventional wisdom may or may not turn out to be true. It is just more probable. As Naren says- Investing is not abt arithmatic, but abt probability.

According to Naren- Large caps and Flexi caps are more attractive than Mid-Small caps. Hybrid funds which do Dynamic Asset Allocation, international funds investing in emerging markets are attractive. So- as an investor, good to not have very large allocations to mid and small caps. Good to diversify across market caps, assets and geographies.


29","nvesting in the Current Stock Market: Strategies from S. Naren (Head of ICICI Prudential Mutual Fund)

Honesty is rare in Indian finance. S. Naren, who manages Rs. 6.5 lakh crore in equity, is an extraordinary mutual fund manager who is warning small investors to get cautious.

S. Naren is a self-confessed fan of Charlie Munger. So, before we begin, here’s a short story Charlie Munger used to tell about fund managers:

""There was this guy who sold fishing rod sets. I asked him: ‘My God, they’re purple and green. Do fish really get attracted by these colors?’ And he said: ‘Mister, I don’t sell to fish.’ Fund managers remind me of that fishing rod salesman.""

Priceless Guidance for Retail Investors from S. Naren’s Recent Interview on CNBC

1. Indian Stock Market Investors are the Sole Risk-Takers Financing the Entire Economy: Stock market investors today do not realize that instead of the banks, it is their hard-earned money which is now financing the companies.

This “investor financing” is happening through over-valued IPOs, QIPs, MNCs Selling, and Promoter Exits.

2. Stocks are Trading at Insane Valuations: The problem with equity investing at present is that stocks are trading at 50 PE, 60 PE etc. in the hope that earnings growth will follow. But what happens if the earnings don’t come?

During the “Lost Decade” from 1994 to 2004, many small and mid-cap companies disappeared. Growth and earnings did not come. Only large caps survived. Same risk applies to today’s over-valued market.

3. Judgment Day May Be Yet to Come: Private equity players who sell over-valued IPOs after cashing multi-bagger returns say “why worry – everyone is making money in India.” But the final time to judge the returns may not be today.

4. “Hold for the Long-Term” Mantra Only Works for Quality Stocks: With good stocks, time is your friend. With bad stocks, time is your enemy. At today’s valuations, even if you buy and hold for the long-term, capital destruction can happen – unless you buy high quality stocks.

5. Three Mistakes Investors Made in the 1990s Bull Market: As the bull market expanded: (a) They reduced the quality of their portfolios (by buying low quality stocks); (b) They reduced the liquidity of their portfolios (by buying illiquid stocks); and (c) They reduced the capitalization of their portfolios (by buying stocks with smaller market caps).

Avoid these 3 mistakes – these are the lessons we learnt from the nineties.

6. India is the Only Market Where IPOs are Still Selling: Private equity investors say India is the only market where they can still sell their IPOs and get profitable exits. They have not made that kind of multi-bagger returns in any other market. 

7. A Stock at 25 PE is Over-valued if There is No Earnings Growth: Most investors don’t understand what it means to buy a stock at 25 P/E with no earnings growth. It means you are paying the price for 25 years’ earnings.

EXPLANATION: If a company has an EPS of Rs. 1 and its stock price is Rs. 25 (P/E = 25). So, you are paying Rs. 25 upfront for that stock. If the company continues to earn Rs. 1 per share every year (no growth in earnings), it will take 25 years (Rs. 1 x 25 years) to recover the initial stock investment of Rs. 25.

Today there are so many companies whose quarterly results come and there is no earnings growth. So, even 20 or 25 P/E for such stocks is an over-valuation.

8. Will Indian Stock Valuations Always Remain High Because Only 6% Households Have Equity Participation and SIP Money Has a Long Runway? Naren: Flows alone cannot determine the valuations of an asset class in the long run. All the market gurus in history have said this.

With the SIP inflows you might extend the over-valued market for another 2 or 3 years. But in the long run, only corporate earnings will determine valuations. Earnings growth is not happening right now in India.

9. Indian Stock Market in Next 2-3 Quarters: If consumption picks up in the festive season, and if credit growth improves (if people start taking fresh loans), then corporate earnings will come. But as of now, credit growth is low, and in this situation, earnings cannot come.

10. Strategy: Invest in Other Global Markets: Most global stock markets are cheaply valued and doing much better than India right now. Investors in India should consider investing in other global stock markets, which will likely deliver multi-year returns because of the low base.

11. Strategy: Diversify to Gold: Gold is no longer cheap, but for the sake of risk diversification, investors should consider investing partially in gold. No asset class is cheap in India right now (except perhaps office properties).

12: Strategy: No Interest in Crypto – Naren: “I’ve seen that whatever Charlie Munger said comes true with a time lag. He was against crypto investing. So, I’ve never considered it as an asset class for my investing.”

13. Strategy: Short-term Investing – Naren: ""In today’s market, even if we find we have a 10% or 20% potential upside in a stock, we buy. And then take a gain, and exit.

If my target upside in a stock is 20%, and the stock price goes down by 5%, then my potential upside becomes 25%. So, we invest in those kinds of short-term opportunities. In that sense, volatility is my friend right now.""

14. Strategy: Oil & Gas Stocks like ONGC/BPCL etc. – Naren: “This is the only pocket where I feel the stock valuations in India may still be reasonable. The goal with low valuations is to limit your downside risk.”

15. Strategy: Pharma Stocks: Tariffs have created uncertainty, but pharma stocks are a multi-decadal story. The world population as well as India’s population is aging. With age, you need more medicines and more healthcare. Demand in this sector will only increase.

16. Strategy: Banking Stocks: Right now, banking growth is restricted because companies don’t need bank credit (as stock investors are financing them.) But whenever stock market correction happens, the banking sector will outperform because then good companies will have to take loans from the banks.

17. Strategy: Personal Investing: Naren is partially invested in his own mutual funds and partially invested in global stocks outside India. Percentage of India vs. Global allocation: Did not reveal.

Endpiece:

Charlie Munger said: “Fish where the fish are.” Right now extremely cheap valuations are available outside India. Look at global stocks with an open mind. If the mind is closed, it is dangerous to play the stock markets.",questions regarding icici prudential mutual fund heads s naren statement hello folks i recently came across this x post summarizing statements by s naren the head of icici prudential mutual fund he mentioned that indian markets are at insane valuations and that a lost decade might come during the lost decade from 1994 to 2004 returns were very weak despite the optimism of the time do we feel that there is another crash coming what are your thoughts on this i would be delighted if veteran investors could share their opinions thank you here is the link have watched this interview s naren is a wise man who explains things in simple terms rather listen to how he says it and what he says directly instead of reading someone elses summary link of this interview because i have read some of these summaries and none captured the essence my learnings from this interview would be conventional wisdom says returns from equity will be lower in next decade than what we saw in last decade conventional wisdom may or may not turn out to be true it is just more probable as naren says investing is not abt arithmatic but abt probability according to naren large caps and flexi caps are more attractive than midsmall caps hybrid funds which do dynamic asset allocation international funds investing in emerging markets are attractive so as an investor good to not have very large allocations to mid and small caps good to diversify across market caps assets and geographies 29,Neutral,21902499.0
2025-12-04,https://m.dailyhunt.in/news/india/english/analyticsinsighteng-epaper-anycinst/best+mutual+funds+to+invest+in+december+2025-newsid-n691689905,dailyhunt,Best Mutual Funds to Invest in December 2025,Overview:Top-performing mutual funds in December 2025 combine strong 3-year CAGR with stable AUM.Flexi Cap and Mid-cap Funds continue to ...,,best mutual funds to invest in december 2025 overviewtopperforming mutual funds in december 2025 combine strong 3year cagr with stable aumflexi cap and midcap funds continue to,Positive,6767237.0
2025-11-24,https://www.linkedin.com/feed/update/urn%3Ali%3Aactivity%3A7398610181351211009,linkedin,"ALT InvestorALT Investor
3,925 followers3,925 followers
2mo • Edited •  2 months ago • Edited • Visible to anyone on or off LinkedIn

Follow

We are back with another insightful podcast! This time, Ankur Jhaveri goes into a deep conversation with Manish Banthia, Chief Investment Officer of Fixed Income at ICICI Prudential AMC Ltd, on the intricacies of debt mutual funds and the importance of asset allocation. 

During the podcast, Manish emphasized the need for retail investors to understand economic cycles and make informed decisions about their portfolios. 

The discussion went on to cover the current state of hashtag#gold and hashtag#silver investments, the role of arbitrage funds, and the risks associated with fixed-income investments. Manish also provided valuable insights into how investors can navigate the market and optimize their returns.","We are back with another insightful podcast! This time, Ankur Jhaveri goes into a deep conversation with Manish Banthia , Chief Investment . ...","podcast! This time, Ankur Jhaveri goes into a deep conversation with Manish Banthia , Chief Investment Officer of Fixed Income at ICICI Prudential AMC Ltd , on the intricacies of debt mutual funds and the importance of asset allocation. During the podcast, Manish emphasized the",alt investoralt investor 3925 followers3925 followers 2mo edited 2 months ago edited visible to anyone on or off linkedin follow we are back with another insightful podcast this time ankur jhaveri goes into a deep conversation with manish banthia chief investment officer of fixed income at icici prudential amc ltd on the intricacies of debt mutual funds and the importance of asset allocation during the podcast manish emphasized the need for retail investors to understand economic cycles and make informed decisions about their portfolios the discussion went on to cover the current state of hashtaggold and hashtagsilver investments the role of arbitrage funds and the risks associated with fixedincome investments manish also provided valuable insights into how investors can navigate the market and optimize their returns we are back with another insightful podcast this time ankur jhaveri goes into a deep conversation with manish banthia chief investment,Neutral,
2025-07-05,https://www.reddit.com/r/IndiaInvestments/comments/1lrh5au/comment/n1g6qcv,reddit.com/r/indiainvestments,"I recently started my first job. And yes emergency fund and insurance are my priority.

Currently I try to invest 30k monthly in the following MFs

Parag Parikh Flexi Cap Fund Direct Growth - 10k

Motilal Oswal Large Cap Fund Direct Growth - 5k

ICICI Prudential Large Cap Fund Direct Growth - 5k

Motilal Oswal Midcap Fund Direct Growth - 5k

Edelweiss US Technology Equity FoF Direct Growth - 5k

How is this fund allocation and how can I improve.",,,i recently started my first job and yes emergency fund and insurance are my priority currently i try to invest 30k monthly in the following mfs parag parikh flexi cap fund direct growth 10k motilal oswal large cap fund direct growth 5k icici prudential large cap fund direct growth 5k motilal oswal midcap fund direct growth 5k edelweiss us technology equity fof direct growth 5k how is this fund allocation and how can i improve,Neutral,12772308.0
2026-01-01,https://www.financialexpress.com/business/news/demand-recovery-to-shape-growth-outlook-in-new-year/4094013/,the financial express,Demand recovery to shape growth outlook in new year,"With rural demand finally outpacing urban growth and private capex pivoting toward deep-tech like AI and semiconductors, India remains the ...","Other asset managers echoed this view. S Naren, ED and CIO, ICICI Prudential AMC, pointed out that policy measures such as tax cuts, GST ...",demand recovery to shape growth outlook in new year with rural demand finally outpacing urban growth and private capex pivoting toward deeptech like ai and semiconductors india remains the,Positive,343822.0
2025-11-08,https://www.reddit.com/r/MutualfundsIndia/comments/1p7wjb0/comment/nr110b9/,reddit.com/r/mutualfundsindia,,,"hanks for the suggestion! I’ll definitely check out ICICI Prudential Multi Asset Fund. I like the idea of diversified allocation across equity/ debt/ gold, so it might fit well. Will study it properly before deciding.",,Neutral,10617726.0
2025-07-18,https://www.linkedin.com/feed/update/urn%3Ali%3Aactivity%3A7351942345904357376,linkedin,,Day 3 at the COFP Annual Retreat continued in full flow with an engaging and eye-opening session by Ms. Arpita Khadria on a topic many ...,nudged us to think harder about how we show up - and how we want to be remembered! Event Partners - HDFC Mutual Fund ICICI Prudential AMC Ltd Bajaj Finserv Asset Management Ltd SBI MUTUAL FUND Sundaram Finance WhiteOak Capital Mirae Asset Mutual Fund (India) Kotak Mutual Fund,day 3 at the cofp annual retreat continued in full flow with an engaging and eyeopening session by ms arpita khadria on a topic many,Neutral,
2025-09-08,https://economictimes.indiatimes.com/markets/expert-view/dividend-stock-investing-how-icici-prudential-mfs-mittul-kalawadia-balances-growth-with-yields/articleshow/123747719.cms,the economic times,Dividend stock investing: How ICICI Prudential MF's Mittul Kalawadia balances growth with yields,"ICICI Prudential AMC's dividend yield strategy, led by Mittul Kalawadia, balances yield sustainability with growth potential across market ...","... , Senior Fund Manager at ICICI Prudential AMC, explains how the fund house strikes the right balance between and . By focusing on ...",dividend stock investing how icici prudential mfs mittul kalawadia balances growth with yields icici prudential amcs dividend yield strategy led by mittul kalawadia balances yield sustainability with growth potential across market,Neutral,801433.0
2025-08-23,https://www.linkedin.com/feed/update/urn%3Ali%3Aactivity%3A7365018244723671040,linkedin,,... 🌐 Clarity in Chaos Investors Market Dialogue - Wealth First Group - August 2025 We had the privilege of hosting an exclusive investor ca ...,"sectoral resilience provide balance. In uncertain times, perspectives like these help investors focus on what truly matters. 🙏 Thank you ICICI Prudential AMC Ltd , Anish Tawakley , Saurabh Mehta and Adrian D'souza for partnering with Wealth First to make this session impactful.",clarity in chaos investors market dialogue wealth first group august 2025 we had the privilege of hosting an exclusive investor ca,Neutral,
2025-11-29,https://www.msn.com/en-in/money/markets/icici-pru-value-fund-50x-growth-in-21-years-rs-5-000-monthly-sip-builds-over-rs-1-crore/ar-AA1RoQN3,msn india,"ICICI Pru Value Fund: 50X growth in 21 years; Rs 5,000 monthly SIP builds over Rs 1 crore",... ; ; ; ICICI Prudential Value Fund is one of the few equity schemes that has successfully completed more than two decades in the market. ...,"... under management and the largest equity fund within the ICICI Prudential Mutual Fund family. Over its full journey of 21 years, 3 months ...",icici pru value fund 50x growth in 21 years rs 5000 monthly sip builds over rs 1 crore icici prudential value fund is one of the few equity schemes that has successfully completed more than two decades in the market,Positive,
2025-10-23,https://m.dailyhunt.in/news/india/english/analyticsinsighteng-epaper-anycinst/best+etfs+to+invest+in+india+in+2025-newsid-n686199245,dailyhunt,Best ETFs to Invest in India in 2025,"CPSE ETF, with a market cap of Rs. 56,773.73 crore and a close price of Rs. 94.09, is a top equity ETF in India. Offering 1-year returns of ...",,best etfs to invest in india in 2025 cpse etf with a market cap of rs 5677373 crore and a close price of rs 9409 is a top equity etf in india offering 1year returns of,Positive,14973137.0
2025-11-26,https://obnews.co/Index/flowNewsDetail/id/12856779.html,obnews,"A Monthly SIP of ₹10,000 in This ICICI Pru Fund Could Have Grown to ₹1 Crore Today",ICICI Prudential Largecap Fund has once again proved why it remains one of the most trusted mutual fund schemes for long-term wealth ...,,a monthly sip of ₹10000 in this icici pru fund could have grown to ₹1 crore today icici prudential largecap fund has once again proved why it remains one of the most trusted mutual fund schemes for longterm wealth,Positive,
2026-01-01,https://www.thehindubusinessline.com/markets/icici-pru-amc-relieves-sankaran-naren-from-managing-dynamic-asset-allocation-fof/article70460288.ece,the hindu business line,ICICI Pru AMC relieves Sankaran Naren from managing Dynamic Asset Allocation FoF,The fund management team has now been revised to include Sharmila D’silva,,icici pru amc relieves sankaran naren from managing dynamic asset allocation fof the fund management team has now been revised to include sharmila dsilva,Neutral,12220656.0
2025-11-27,https://www.goodreturns.in/personal-finance/best-mutual-funds-icici-hdfc-sbi-nippon-among-consistent-performers-in-mid-small-large-cap-cate-1472803.html,goodreturns,"Best Mutual Funds: ICICI, HDFC, SBI Nippon Among Consistent Performers In Mid, Small, Large Cap Categories",Best Mutual Funds: Growing Systematic Investment Plan (SIP) inflows are a reflection of the growing trend of mutual fund investment in ...,,best mutual funds icici hdfc sbi nippon among consistent performers in mid small large cap categories best mutual funds growing systematic investment plan sip inflows are a reflection of the growing trend of mutual fund investment in,Positive,6319982.0
2025-11-28,https://www.financialexpress.com/money/best-index-funds-smallcap-midcap-and-nifty-50-compared-across-3-5-and-10-year-return-charts-4058642/,the financial express,"Best index funds: Smallcap, midcap and Nifty 50 compared across 3, 5 and 10-year return charts","India's index fund landscape changes dramatically when you compare 3-year, 5-year and 10-year performance charts. Smallcap and thematic ...",,best index funds smallcap midcap and nifty 50 compared across 3 5 and 10year return charts indias index fund landscape changes dramatically when you compare 3year 5year and 10year performance charts smallcap and thematic,Neutral,11280189.0
2025-09-30,https://www.cnbctv18.com/personal-finance/icici-prudential-mf-launches-conglomerate-themed-fund-nfo-opens-in-three-days-19697278.htm,cnbc-tv18,ICICI Prudential MF launches conglomerate-themed fund; NFO opens in three days,"ICICI Prudential Mutual Fund will open its Conglomerate Fund NFO on Oct 3, targeting promoter-led groups across sectors.","... ICICI Prudential Mutual Fund will open its Conglomerate Fund NFO on Oct 3, targeting promoter-led groups across sectors. ICICI Prudential ...",icici prudential mf launches conglomeratethemed fund nfo opens in three days icici prudential mutual fund will open its conglomerate fund nfo on oct 3 targeting promoterled groups across sectors,Neutral,313329.0
2025-08-05,https://www.zeebiz.com/personal-finance/mutual-fund/photo-gallery-nippon-india-icici-prudential-invesco-india-dsg-large-cap-hdfc-bandhan-baroda-bnp-paribas-direct-growth-large-cap-funds-with-highest-mutual-fund-sip-return-calculator-375570,zee business,Top 7 largecap mutual funds; know how much return top fund has given in 5 years,The seventh fund on the list is Baroda BNP Paribas Large Cap Fund. It has given a 16.56 per cent SIP return in five years. The fund size is ...,,top 7 largecap mutual funds know how much return top fund has given in 5 years the seventh fund on the list is baroda bnp paribas large cap fund it has given a 1656 per cent sip return in five years the fund size is,Neutral,58845.0
2025-11-22,https://m.dailyhunt.in/news/india/english/analyticsinsighteng-epaper-anycinst/best+performing+low+risk+mutual+funds+for+2025-newsid-n690146131,dailyhunt,Best Performing Low-Risk Mutual Funds for 2025,"Overview:Diversified allocation across equity, debt and commodities supports steadier growth in changing markets.Low-risk hybrid and ...",,best performing lowrisk mutual funds for 2025 overviewdiversified allocation across equity debt and commodities supports steadier growth in changing marketslowrisk hybrid and,Positive,7020100.0
2025-10-28,https://www.moneycontrol.com/news/business/markets/after-the-midcap-mania-market-experts-bet-on-largecaps-for-next-round-of-alpha-13637978.html,moneycontrol.com,"After the midcap mania, market experts bet on largecaps for next round of alpha","With mid and small caps trading at frothy valuations, fund managers at the Moneycontrol Mutual Fund Summit 2025 said large caps could lead ...","... may come from large caps. Anish Tawakley, Co-CIO (Equity), ICICI Prudential AMC, said the market’s recent consolidation was natural after ...",after the midcap mania market experts bet on largecaps for next round of alpha with mid and small caps trading at frothy valuations fund managers at the moneycontrol mutual fund summit 2025 said large caps could lead,Neutral,14973137.0
2025-10-22,https://www.zeebiz.com/personal-finance/mutual-fund/photo-gallery-top-7-large-and-midcap-mutual-funds-in-5-years-rs-1600000-lump-sum-investment-in-no-1-scheme-has-led-to-rs-603-lakh-motilaloswal-icici-hdfc-invesco-quant-uti-bandhan-381475,zee business,"Top 7 Large & Midcap Mutual Funds in 5 Years: Rs 16,00,000 lump sum investment in No. 1 scheme has led to Rs 60.3 lakh wealth",Large & midcap mutual funds are equity funds that invest in both largecap and midcap companies. These funds invest in the top 200 companies ...,,top 7 large midcap mutual funds in 5 years rs 1600000 lump sum investment in no 1 scheme has led to rs 603 lakh wealth large midcap mutual funds are equity funds that invest in both largecap and midcap companies these funds invest in the top 200 companies,Neutral,189838.0
2025-11-19,https://www.equitymaster.com/the-fundstrategist/detail.asp?date=11/19/2025&story=5&title=2026-Watchlist-3-High%2DPerforming-Multi-Cap-Mutual-Funds,equitymaster.com,2026 Watchlist: 3 High-Performing Multi Cap Mutual Funds,"Image source: ipopba/www.istockphoto.com If you want to maintain a balanced approach to largecaps, midcaps, and smallcaps, then among the ...",,2026 watchlist 3 highperforming multi cap mutual funds image source ipopbawwwistockphotocom if you want to maintain a balanced approach to largecaps midcaps and smallcaps then among the,Positive,347930.0
2025-09-01,https://economictimes.indiatimes.com/mf/analysis/nifty-next-50-can-this-be-your-next-move-in-largecap-investing/articleshow/123632272.cms,the economic times,Nifty Next 50: Can this be your next move in largecap investing,"What next? We often ask ourselves this question as we move ahead in life - after passing an important academic exam, after getting promoted ...",... - Chintan Haria is Principal- Investment Strategy at ICICI Prudential AMC) Add as a Reliable and Trusted News Source Add Now!,nifty next 50 can this be your next move in largecap investing what next we often ask ourselves this question as we move ahead in life after passing an important academic exam after getting promoted,Positive,25558809.0
