date,url,source_name,title,opening_text,hit_sentence,processed_text,sentiment,reach
2026-01-17,https://www.businessworld.in/article/icici-prudential-mutual-fund-launches-two-offerings-under-the-isif-segment-587707,bw businessworld,ICICI Prudential Mutual Fund Launches Two Offerings Under The iSIF Segment,iSIF Equity Ex-Top 100 Long-Short Fund and iSIF Hybrid Long-Short Fund,"... limit). Speaking at the launch, Sankaran Naren, ED & CIO, ICICI Prudential AMC, said: “Through the iSIF segment, we are offering ...",icici prudential mutual fund launches two offerings under the isif segment isif equity extop 100 longshort fund and isif hybrid longshort fund,Neutral,1016871.0
2026-03-09,https://economictimes.indiatimes.com/wealth/invest/best-fund-managers-2025-top-wealth-creators-who-mastered-the-balance-between-risk-and-returns/articleshow/129193733.cms,the economic times,Best Fund Managers 2025: Top wealth creators who mastered the balance between risk and returns,Indian equity fund managers navigated a challenging market by prioritising risk management and resilience. Many adopted conservative ...,"... at Nippon India Asset Management Company (AMC) and ICICI Prudential AMC earlier, Gunwani has now put his stamp on equity ...",best fund managers 2025 top wealth creators who mastered the balance between risk and returns indian equity fund managers navigated a challenging market by prioritising risk management and resilience many adopted conservative,Positive,
2026-03-12,https://www.cnbctv18.com/personal-finance/icici-prudential-equity-debt-fund-1000-sip-into-4-crore-26-years-calculator-ws-el-19866594.htm,cnbc-tv18,"A hybrid mutual fund has turned ₹1,000 monthly SIP into over ₹4 crore in 26 years","A ₹1,000 monthly SIP in ICICI Prudential Equity & Debt Fund since Nov 1999 would grow to ₹4 crore by Feb 28, 2026. A ₹1 lakh lump sum would ...","... returns across market cycles. Sankaran Naren, ED & CIO, ICICI Prudential AMC, said, “Hybrid funds play an important role in helping ...",a hybrid mutual fund has turned ₹1000 monthly sip into over ₹4 crore in 26 years a ₹1000 monthly sip in icici prudential equity debt fund since nov 1999 would grow to ₹4 crore by feb 28 2026 a ₹1 lakh lump sum would,Positive,16655916.0
2025-10-20,https://economictimes.indiatimes.com/mf/analysis/how-to-invest-for-a-balanced-portfolio-this-diwali-7-experts-offer-help/slideshow/124704252.cms,the economic times,How to invest for a balanced portfolio this Diwali? 7 experts offer help,... 1 / 8 Financial investment this Diwali Are you planning to invest and have a balanced portfolio this Diwali? 7 experts offer help and ...,"... keep it efficient. 4 / 8 Sankaran Naren, ED and CIO, ICICI Prudential Mutual Fund Asset allocation is of prime importance. So, the ...",how to invest for a balanced portfolio this diwali 7 experts offer help 1 8 financial investment this diwali are you planning to invest and have a balanced portfolio this diwali 7 experts offer help and,Neutral,23778251.0
2025-07-01,https://economictimes.indiatimes.com/mf/mf-news/nfo-update-icici-prudential-mutual-fund-launches-nifty-private-bank-index-fund/articleshow/122176326.cms,the economic times,NFO Update: ICICI Prudential Mutual Fund launches Nifty Private Bank Index Fund,"ICICI Prudential launches a Nifty Private Bank Index Fund, offering low-cost exposure to top private banks driving India’s growth. The ...","... , and long-term potential in banking. ICICI Prudential Mutual Fund made a complete exit from three stocks in May. It sold Dr Lal Pathlabs, ...",nfo update icici prudential mutual fund launches nifty private bank index fund icici prudential launches a nifty private bank index fund offering lowcost exposure to top private banks driving indias growth the,Positive,62646070.0
,https://play.google.com/store/apps/details?id=com.iPruAMC&hl=en_IN,nan,,"yours is the most hopeless mutual fund app ever in terms of registration...i being a way long investor in mutual funds,have been using apps of different AMCs for long... enjoyed comfortable and smooth usage.. until I got to know about your app...God bless you",,yours is the most hopeless mutual fund app ever in terms of registrationi being a way long investor in mutual fundshave been using apps of different amcs for long enjoyed comfortable and smooth usage until i got to know about your appgod bless you,Negative,
2026-01-05,https://www.moneycontrol.com/news/business/personal-finance/active-vs-passive-multi-asset-funds-what-s-the-difference-and-how-should-investors-choose-13755838.html,moneycontrol.com,Active vs passive multi-asset funds: What’s the difference and how should investors choose?,Active management is based on the belief that skilled managers can generate alpha through market insight and tactical adjustments. Passive ...,"... time. That’s why it is worth pausing when S Naren, CIO of ICICI Prudential AMC, chooses to invest his money in a passive multi-asset fund ...",active vs passive multiasset funds whats the difference and how should investors choose active management is based on the belief that skilled managers can generate alpha through market insight and tactical adjustments passive,Neutral,313329.0
2025-09-02,https://www.equitymaster.com/the-fundstrategist/detail.asp?date=09/02/2025&story=7&title=3-Mutual-Funds-That-are-Down-Less-Than-5-in-the-Market-Downturn,equitymaster.com,3 Mutual Funds That are Down Less Than 5% in the Market Downturn,"Image source: bee32/www.istockphoto.com Indian equity markets have experienced a decline over the last one year, with the midcap and ...",,3 mutual funds that are down less than 5 in the market downturn image source bee32wwwistockphotocom indian equity markets have experienced a decline over the last one year with the midcap and,Positive,3725013.0
2025-09-16,https://www.linkedin.com/feed/update/urn%3Ali%3Aactivity%3A7373752780970344448,linkedin,,"... 🌟 A proud moment for us at Ekvity! Our Co-founder & Investment Advisor, Kharanshu Parikh , will be moderating a power-packed panel ...",": 	•	 Anurag M. – Head, Fixed Income, UTI AMC 	•	 Manish R Karnavar – Head, Family Office & Head – Product Communication (Mutual Funds), ICICI Prudential AMC 	•	Deepak Agrawal – CIO – Debt & Head – Product, Kotak Mahindra MF 📅 Thursday, September 18, 2025 ⏰ 5 – 6 PM 📍 Zoom We’",a proud moment for us at ekvity our cofounder investment advisor kharanshu parikh will be moderating a powerpacked panel,Neutral,
2025-09-24,https://www.shiksha.com/mba/articles/best-mba-colleges-in-kalyan-courses-fees-admission-entrance-exams-placements-blogId-210922,shiksha.com,"Best MBA Colleges in Kalyan: Courses, Fees, Admission, Entrance Exams, Placements",Students can study an MBA at numerous MBA colleges in Kalyan. Most colleges admit students based on the scores of commonly accepted ...,,best mba colleges in kalyan courses fees admission entrance exams placements students can study an mba at numerous mba colleges in kalyan most colleges admit students based on the scores of commonly accepted,Neutral,18307950.0
2026-03-06,https://www.linkedin.com/feed/update/urn%3Ali%3Aactivity%3A7435637202161922049,linkedin,,"At the fourth edition of IDFC FIRST Bank Presents Outlook Money 40 After 40, Sankaran Naren , Executive Director & CIO, ICICI Prudential ...","At the fourth edition of IDFC FIRST Bank Presents Outlook Money 40 After 40, Sankaran Naren , Executive Director & CIO, ICICI Prudential AMC Ltd , shed light on some of the most overlooked risks in retirement planning today. With longer life expectancy and ever-increasing",at the fourth edition of idfc first bank presents outlook money 40 after 40 sankaran naren executive director cio icici prudential,Neutral,
2025-10-28,https://www.moneycontrol.com/news/business/markets/defence-theme-still-has-firepower-but-it-is-no-longer-a-blind-bet-say-experts-13638002.html,moneycontrol.com,"Defence theme still has firepower but it is no longer a blind bet, say experts","The defence rally isn’t done yet, but fund managers say this leg of the journey will reward patience, selectivity, and real earnings power ...","... narratives,” he said. Anish Tawakley, Co-CIO (Equity) at ICICI Prudential AMC, added a note of caution. “Defence has become a consensus ...",defence theme still has firepower but it is no longer a blind bet say experts the defence rally isnt done yet but fund managers say this leg of the journey will reward patience selectivity and real earnings power,Neutral,12772308.0
2026-02-07,https://www.etnownews.com/news/exclusive-if-ai-trade-cracks-can-indian-markets-outperform-icici-prudentials-s-naren-explains-article-153575256,et now,"EXCLUSIVE | If AI trade cracks, can Indian markets outperform? ICICI Prudential's S Naren explains","S Naren described India as positioned as the ""anti-AI trade"" in a world pouring massive capital into AI infrastructure, particularly in ...",,exclusive if ai trade cracks can indian markets outperform icici prudentials s naren explains s naren described india as positioned as the antiai trade in a world pouring massive capital into ai infrastructure particularly in,Neutral,11145929.0
2025-08-12,https://www.reddit.com/r/mutualfunds/comments/1mod0hr,reddit.com/r/mutualfunds,"Has RBI removed the limits in foreign funds? I believe ICICI Prudential NASDAQ fund is open for investment. Can anyone please check?
I can see there is no tracking error.","BI hasn't removed the restriction.

A few funds open up time to time as AUM drops due to fluctuations in the market.

ICICI Pru NASDAQ Fund was one of them. I believe the window for this fund has closed again.


9
rmadaan3
•
6mo ago
Yup. I put in one SIP and it paused automatically today.

3
Fabulous_Educator_18
•
6mo ago
It’s closed again.",,has rbi removed the limits in foreign funds i believe icici prudential nasdaq fund is open for investment can anyone please check i can see there is no tracking error bi hasnt removed the restriction a few funds open up time to time as aum drops due to fluctuations in the market icici pru nasdaq fund was one of them i believe the window for this fund has closed again 9 rmadaan3 6mo ago yup i put in one sip and it paused automatically today 3 fabulouseducator18 6mo ago its closed again,Neutral,
2025-11-27,https://www.news18.com/business/savings-and-investments/multi-asset-funds-or-aggressive-hybrid-funds-who-outperformed-over-10-years-9734616.html,news18,Multi-Asset Funds Or Aggressive Hybrid Funds: Who Outperformed Over 10 Years?,Multi-asset or aggressive hybrid funds- which is better for long-term wealth? We break down 10-year returns to help you choose the right ...,,multiasset funds or aggressive hybrid funds who outperformed over 10 years multiasset or aggressive hybrid funds which is better for longterm wealth we break down 10year returns to help you choose the right,Neutral,121388.0
2026-01-21,https://www.linkedin.com/feed/update/urn%3Ali%3Aactivity%3A7419685993731178496,linkedin,,A heartfelt thank you to our esteemed #partners and #sponsors who continue to power the journey of GCA. As we celebrate the Silver Jubilee . ...,"of the Global Conference of Actuaries, we are delighted to welcome ACTEX Learning IIRM-Distance Learning Program @III @NII ICICI Prudential AMC Ltd onboard for #GCA26 . Your support strengthens our shared vision of advancing actuarial science and shaping the future of finance.",a heartfelt thank you to our esteemed partners and sponsors who continue to power the journey of gca as we celebrate the silver jubilee,Positive,
2025-12-24,https://www.thehindubusinessline.com/markets/retail-investors-continue-to-bet-big-on-etfs/article70433732.ece,the hindu business line,Retail investors continue to bet big on ETFs,Investors are increasingly looking at exchange traded funds (ETFs – metals and equity) and index funds as a core allocation tool while ...,"... ,” says Chintan Haria, Principal - Investment Strategy, ICICI Prudential AMC. Passives to rule 2026 While the demand for ETFs is ...",retail investors continue to bet big on etfs investors are increasingly looking at exchange traded funds etfs metals and equity and index funds as a core allocation tool while,Positive,5621019.0
2026-02-11,https://www.cnbctv18.com/personal-finance/icici-prudential-business-cycle-mutual-fund-sip-10000-into-10-lakh-5-years-ws-el-19847707.htm,cnbc-tv18,"This mutual fund has turned a ₹10,000 monthly SIP into nearly ₹10 lakh in 5 years","ICICI Prudential Business Cycle Fund delivered a 18.47% CAGR for SIP investors in five years, outperforming Nifty 500 TRI. S Naren ...","S Naren, Executive Director and Chief Investment Officer at ICICI Prudential AMC, noted that “a large part of India’s economy is inherently ...",this mutual fund has turned a ₹10000 monthly sip into nearly ₹10 lakh in 5 years icici prudential business cycle fund delivered a 1847 cagr for sip investors in five years outperforming nifty 500 tri s naren,Neutral,14580306.0
2025-12-01,https://m.dailyhunt.in/news/india/english/goodreturns-epaper-goreturn/sebi+gives+green+light+to+icici+prudential+amc+s+mega+ipo+49+million+shares+on+offer-newsid-n691361025,dailyhunt,SEBI Gives Green Light To ICICI Prudential AMC's Mega IPO; 49 Million Shares On Offer,"The Securities and Exchange Board of India (SEBI), the capital markets regulator, has given Mumbai-based ICICI Prudential Asset Management ...",SEBI Gives Green Light To ICICI Prudential AMC's Mega IPO; 49 Million Shares On Offer,sebi gives green light to icici prudential amcs mega ipo 49 million shares on offer the securities and exchange board of india sebi the capital markets regulator has given mumbaibased icici prudential asset management,Neutral,
2025-10-23,https://m.dailyhunt.in/news/india/english/analyticsinsighteng-epaper-anycinst/top+high+return+small+cap+mutual+funds+in+india-newsid-n686199242,dailyhunt,Top High-Return Small Cap Mutual Funds in India,"Quant Small Cap Fund: Achieved a 5-year CAGR of 47.1%, focusing on high-quality small-cap stocks with a disciplined, research-driven ...",,top highreturn small cap mutual funds in india quant small cap fund achieved a 5year cagr of 471 focusing on highquality smallcap stocks with a disciplined researchdriven,Positive,5814639.0
2025-12-09,https://www.financialexpress.com/money/best-low-cost-retirement-mutual-fund-this-icici-pru-fund-tops-1-3-and-5-year-return-charts-4070465/,the financial express,"Best low-cost retirement mutual fund: THIS ICICI Pru fund tops 1, 3 and 5-year return charts","ICICI Prudential Retirement Fund – Pure Equity – Direct Plan has emerged as the best-performing low-cost retirement mutual fund, topping 1, ...","... retirement fund, launched on February 7, 2019 under the ICICI Prudential Mutual Fund umbrella. Since inception, it has delivered a robust ...",best lowcost retirement mutual fund this icici pru fund tops 1 3 and 5year return charts icici prudential retirement fund pure equity direct plan has emerged as the bestperforming lowcost retirement mutual fund topping 1,Positive,16655916.0
2025-09-30,https://www.businesstoday.in/personal-finance/news/story/icici-prudential-conglomerate-equity-fund-nfo-october-496327-2025-09-30,business today,ICICI Prudential MF launches conglomerate-focused equity scheme,ICICI Prudential Conglomerate Fund’s investment universe includes significant representation from promoter-led groups with activity in ...,"... Naren, executive director and chief investment officer at ICICI Prudential AMC. ICICI Prudential Mutual Fund underlined that ...",icici prudential mf launches conglomeratefocused equity scheme icici prudential conglomerate funds investment universe includes significant representation from promoterled groups with activity in,Neutral,33585792.0
2025-12-09,https://www.linkedin.com/feed/update/urn%3Ali%3Aactivity%3A7404016966375522304,linkedin,,Rajasthan and CSR Here are the Top 5 Districts and Top 5 CSR Contributors driving meaningful impact in Rajasthan. Stay connected as we ...,"all Indian States and UTs. Tell us in the comments which State you would like to see next! Hindustan Zinc , HDFC Bank , Chambal Fertilisers and Chemicals Limited , ICICI Prudential AMC Ltd , G R Infraprojects Limited Arun Marette Parthesh Vyas #CSRMaps #CSR #ImpactInvesting",rajasthan and csr here are the top 5 districts and top 5 csr contributors driving meaningful impact in rajasthan stay connected as we,Positive,
,https://www.mouthshut.com/product-reviews/icici-prudential-mutual-fund-reviews-925602486,mouthshut,Customer Support,"There is a definite downslide in their services and record keeping, , in one of our various schemes with this fund the statement of account issued by themseven years ago has rightly mentioned the nomination of my heir , , but their latest statement with the same folio is showing nomination required , , no rectification made despite reminders mailed",,customer support there is a definite downslide in their services and record keeping in one of our various schemes with this fund the statement of account issued by themseven years ago has rightly mentioned the nomination of my heir but their latest statement with the same folio is showing nomination required no rectification made despite reminders mailed,Negative,
2026-01-01,https://www.cnbctv18.com/market/stock-picking-sector-calls-key-in-mature-bull-market-icici-prudential-amc-s-naren-artificial-intelligence-it-sector-alpha-article-19811150.htm,cnbc-tv18,"From pharmaceuticals to software and healthcare, where S Naren sees opportunity now","ICICI Prudential AMC CIO S Naren said the market is in a mature bull phase, making stock picking more important than sector calls. He said ...","... , across all styles. And that is what everyone in ICICI Prudential AMC is continuously working on. You picked up shares through ...",from pharmaceuticals to software and healthcare where s naren sees opportunity now icici prudential amc cio s naren said the market is in a mature bull phase making stock picking more important than sector calls he said,Neutral,245580.0
2025-07-03,https://www.financialexpress.com/money/best-multi-cap-mutual-funds-to-invest-in-2025-3901512/,the financial express,Best multi cap mutual funds to invest in 2025,This article breaks down the highest returning Multi Cap Mutual Funds through SIPs and why they matter in India’s current market ...,,best multi cap mutual funds to invest in 2025 this article breaks down the highest returning multi cap mutual funds through sips and why they matter in indias current market,Positive,8740784.0
2025-08-22,https://economictimes.indiatimes.com/mf/analysis/35-equity-mutual-funds-complete-over-25-years-in-2025-how-much-returns-did-they-offer/articleshow/123449040.cms,the economic times,35 equity mutual funds complete over 25 years in 2025. How much returns did they offer?,"As numerous new schemes emerge, 35 equity mutual funds in India have marked 25 years. These include ELSS, large and mid-cap, large-cap, ...",,35 equity mutual funds complete over 25 years in 2025 how much returns did they offer as numerous new schemes emerge 35 equity mutual funds in india have marked 25 years these include elss large and midcap largecap,Neutral,12220656.0
2026-01-19,https://www.business-standard.com/finance/personal-finance/midcaps-to-hybrids-inside-icici-prudential-s-new-isif-long-short-funds-126011900516_1.html,business standard,Midcaps to Hybrids: Inside ICICI Prudential's new iSIF Long-Short funds,Don't miss the most important news and views of the day. Get them on our Telegram channel,"... across market cycles,"" said Sankaran Naren, ED & CIO, ICICI Prudential AMC.",midcaps to hybrids inside icici prudentials new isif longshort funds dont miss the most important news and views of the day get them on our telegram channel,Neutral,30113088.0
